index,published,topic,term,domain,language,valid,de,title,description,en,la,url,image,archive,content,quote,added,feed,country,ipcc,continent
bff4264061359eb3bf1bde0ff37b3ab0,2026-01-01T07:00:04Z,Drought,日照り続く日本,mobilelaby.com,ja,0.1,"Bis zu 56 % Rabatt!! Machen Sie Ihr neues Jahr zu einem Smart Home mit dem ersten Angebot von SwitchBot: Empfohlene Sets für verschiedene Zwecke. Am 3. Januar findet ab 9 Uhr morgens ein toller Sale mit bis zu 56 % Rabatt auf SwitchBot-Produkte statt.

SwitchBot stellte außerdem einen Gutscheincode über 400 Yen Rabatt zur Verfügung, „26NEW02“. Es kann in Verbindung mit Verkaufspreisen verwendet werden, sodass Sie das Produkt, an dem Sie interessiert sind, einfacher als gewöhnlich kaufen können.

Wir stellen Kombinationen vor, die je nach Wunsch nachgeahmt werden können, darunter Smart-Home-Einführungssets, Eingangsschlösser und Reinigungsautomatisierung. Wenn das neue Jahr näher rückt, sollten wir die kleinen Aufgaben zu Hause auf einmal reduzieren.



Smart-Home-Einführungsset

Von nun an wird es ein Smart Home...",最大56%オフ!! SwitchBot初売りセールで新年スマートホーム化：目的別おすすめセット,"SwitchBotの製品が最大56%オフになる、お得なセールが1月3日9時から開催されます。

SwitchBotから400円オフのクーポンコード「26NEW02」も提供されました。セール価格と併用できるので、気になっていた製品をいつもより手軽に導入するチャンスです。

スマートホーム入門セットをはじめ、玄関の鍵や掃除の自動化など、やりたいこと別にそのまま真似できる組み合わせを紹介します。新年のタイミングで、家の小さな手間をまとめて減らしていきましょう。



スマートホーム入門セット

これからスマートホーム化…","Up to 56% off!! Make your new year smart home with SwitchBot's first sale: Recommended sets for different purposes. A great sale with up to 56% off on SwitchBot products will be held from 9am on January 3rd.

SwitchBot also provided a coupon code of 400 yen off, ``26NEW02''. It can be used in conjunction with sale prices, so it's a chance to purchase the product you've been interested in more easily than usual.

We will introduce combinations that can be imitated depending on what you want to do, including smart home introductory sets, entrance locks, and cleaning automation. As the new year approaches, let's reduce the small tasks at home all at once.



Smart home introductory set

From now on, it will become a smart home...","Usque ad 56% off!! Fac domum tuam novum annum callidum cum prima venditione SwitchBot: Commendatur ponit ad diversos usus. Magna venditio cum usque ad 56% off in SwitchBot producta tenebitur ex 9am die 3 Ianuarii.

SwitchBot etiam codici de 400 nummis aureis praebebat, `26NEW02'. Coniunctim cum pretiis venditionis adhiberi potest, ut facultas emendi factum te solito facilius quam solitum fuistis.

Compositiones inducemus quae imitari possunt secundum quod vis facere, inter quas dolor domus introductorias ponit, seras introitus, et automationem purgatio. Cum novus annus accedit, parva negotia domi statim reducamus.



Dolor home introductory set

Posthac, efficitur dolor penatibus...",https://mobilelaby.com/blog-entry-amazon-new-year-sale-switchbot-2026.html,https://i0.wp.com/mobilelaby.com/wp/wp-content/uploads/amazon-new-year-sale-switchbot-2026.jpg?fit=1280%2C848&ssl=1,,"1
2
<ul><li></li><li></li><li>UltraPro</li><li>()BluetoothUltraPro</li><li>ICennkaPASMO</li></ul>
SwitchBotSwitchBot S10125.2
S10
SwitchBot",,2026-01-02 20:54:06+00:00,edo,Japan,EAS,Asia
b4988d15edb462aa868dc1e327c526c3,2026-01-01T10:50:00Z,Precipitation,土砂降りのゾナ・シュール,uekusak.cocolog-nifty.com,ja,0.2,"Die Zukunft der Parlamentswahlen zum Repräsentantenhaus 2026. Euch allen ein frohes neues Jahr.
Ich bete, dass 2026 ein Jahr des Friedens und der Ruhe wird und dass es für alle ein wunderbares Jahr wird.
Ich möchte über diesen Blog und E-Mail-Newsletter wahrheitsgetreue Informationen versenden.
Wir bitten Sie in diesem Jahr demütig um Ihre weitere Unterstützung.
Vielen Dank, dass Sie unseren E-Mail-Newsletter gelesen haben.

Im Jahr 2026 hat das Jahr von Hinoeuma begonnen.
In Sanmeigaku, einer alten chinesischen Schicksalstheorie, ist C das feurige Yang und repräsentiert die Sonne.
Der Nachmittag ist auch ein feuriges Yang, das das Feuer des Mittsommers darstellt.
Heigo, das alle 60 Jahre stattfindet, markiert den Höhepunkt der Fröhlichkeit.
…",2026年衆院総選挙のゆくえ,"みなさま、新年あけましておめでとうございます。
２０２６年が平和で穏やかな年になり、みなさまにとって素晴らしい一年になることを祈念いたします。
本ブログ、メルマガを通じて真実の情報を発信してまいりたく思います。
本年も変わらぬご高配を賜りますよう謹んでお願い申し上げます。
メルマガご高読も謹んでお願い申し上げます。

２０２６年、丙午（ひのえうま）の年が明けた。
中国古来の運命学である算命学では、丙は火性の陽で太陽を表す。
午も火性の陽で真夏の火を表す。
６０年に１度の年回りである丙午は陽気のピークを示すもの。
…","The future of the 2026 House of Representatives general election. Happy New Year to all of you.
I pray that 2026 will be a year of peace and calm, and that it will be a wonderful year for everyone.
I would like to send out true information through this blog and email newsletter.
We humbly ask for your continued support this year.
Thank you very much for reading our e-mail newsletter.

In 2026, the year of Hinoeuma has begun.
In Sanmeigaku, an ancient Chinese theory of fate, C is the fiery yang and represents the sun.
The afternoon is also a fiery yang, representing the fire of midsummer.
Heigo, which occurs once every 60 years, marks the peak of cheerfulness.
…","Futurum 2026 Domus Legatorum electionem generalem. Novus annus ad vos omnes.
Oro ut 2026 annus pacis et tranquillitatis erit, et annus erit omnibus mirabilis.
Vellem veras informationes mittere per hoc diarium et inscriptionem electronicam.
Tuis continuis hoc anno subsidia suppliciter exoptamus.
Optime tibi gratias ago pro legendi nostri e-mail newsletter.

Anno 2026, annus Hinoeuma incepit.
In Sanmeigaku, antiqua Sinensium ratio fatorum, C est igneus Yang et solem repraesentat.
Igneus etiam Yang meridianus est, qui ignem solstitionis significat.
Heigo, quod semel singulis 60 annis occurrit, apicem hilaritatis notat.
...",http://uekusak.cocolog-nifty.com/blog/2026/01/post-00d59e.html,https://uekusak.cocolog-nifty.com/blog/images/mof02_20250612151801.jpg,,みなさま、新年あけましておめでとうございます。２０２６年が平和で穏やかな年になり、みなさまにとって素晴らしい一年になることを祈念いたします。本ブログ、メルマガを通じて真実の情報を発信してまいりたく思います。本年も変わらぬご高配を賜りますよう謹んでお願い申し上げます。メルマガご高読も謹んでお願い申し上げます。２０２６年、丙午（ひのえうま）の年が明けた。中国古来の運命学である算命学では、丙は火性の陽… [+2720 chars],,2026-01-03 02:29:11+00:00,wmo,Ecuador,NWS,South-America
5504d9cbe0978ab23c419fc9f488d43c,2026-01-01T15:01:00Z,Thunderstorm,雷雨南アフリカ,nightwalker.cocolog-nifty.com,ja,0.2,Wertentwicklung jeder Anlageklasse　2025/12. Fixpunktbeobachtung der Performance jeder Anlageklasse in diesem Monat. Diesmal sind es 12...,各資産クラスのパフォーマンス　2025/12,今月の各資産クラスのパフォーマンスの定点観測です。　今回は12...,Performance of each asset class　2025/12. Fixed-point observation of the performance of each asset class this month. This time it's 12...,Quisque euismod dignissim class　2025/12. Certum punctum observationis observantiae cuiusque dignissim classis hoc mense. Hoc tempore est XII...,http://nightwalker.cocolog-nifty.com/money/2026/01/post-8ab469.html,https://nightwalker.cocolog-nifty.com/money/images/202601021.png,,"(adsbygoogle = window.adsbygoogle || []).push({ google_ad_client: ""ca-pub-7186741224709017"", enable_page_level_ads: true });(adsbygoogle = window.adsbygoogle || []).push({});今月の各資産クラスのパフォーマンスの定点観測です。… [+18567 chars]",,2026-01-03 20:52:58+00:00,wmo,South Africa,WSAF,Africa
c497f651413a4734a116bbfe5bc67e8a,2026-01-02T01:30:00Z,Fog,霧のラトビア,hatenanews.com,ja,0.4444444444444444,"[Der große Neujahrsverkauf ist da! ] Go, TypeScript, Rust, Terraform, AI, Englisch & Qualifikationen – Lernen Sie auf Udemy die Fähigkeiten, um im Entwicklungsbereich im Jahr 2026 zu leben! Der Beginn des Jahres, wenn Sie viel Freizeit haben, ist eine großartige Gelegenheit, Ihre Fähigkeiten zu überprüfen und sich auf den nächsten Schritt vorzubereiten.
Mit dem Aufkommen der KI hat sich die Geschwindigkeit der Änderungs- und Aktualisierungszyklen in der Entwicklungsumgebung stärker beschleunigt als je zuvor, und um weiterhin präsent zu sein, ist es wichtig, die Einstellung „Niemals aufhören zu lernen“ einzunehmen.

In diesem Sonderbeitrag stellen wir sowohl Standardtechniken vor, die auf diesem Gebiet unverzichtbar sind, als auch neue Techniken, die Sie jetzt kennen sollten. Wir nutzen große Sprachen wie Go, TypeScript und Rust, aber auch moderne Entwicklungsplattformen wie Container-Technologie und Terraform sowie Observability, das immer mehr Beachtung findet...",【新年のビッグセール到来！】Go・TypeScript・Rust・Terraform・AI・英語＆資格 - 2026年の開発現場で生きる技術をUdemyで学ぶ！,"時間にゆとりのある年始は、自身の技術を見直し、次のステップへ備える絶好の機会です。
AIの登場により、かつて以上に変化のスピードとアップデートのサイクルが加速した開発環境のなかで、存在感を発揮し続けるために重要なのは、やはり「学びを止めない」姿勢でしょう。

本特集では、現場で必須となる定番技術と、いまのうちに知っておきたい新しい技術を両軸で紹介します。GoやTypeScript、Rustといった主要言語をはじめ、コンテナ技術やTerraformなどモダンな開発基盤、そして注目を集めるObservabilityの…","[New year's big sale has arrived! ] Go, TypeScript, Rust, Terraform, AI, English & Qualifications - Learn the skills to live in the development field in 2026 on Udemy! The beginning of the year, when you have a lot of free time, is a great opportunity to review your skills and prepare for the next step.
With the advent of AI, the speed of change and update cycles have accelerated more than ever before in the development environment, and in order to continue to make a presence felt, it is important to have the attitude of ""never stop learning.""

In this special feature, we will introduce both standard techniques that are essential in the field and new techniques that you should know about now. We use major languages ​​such as Go, TypeScript, and Rust, as well as modern development platforms such as container technology and Terraform, as well as Observability, which is attracting attention...","[Magna venditio anni advenit! ] Ite, TypeScript, Rust, Terraform, AI, English & Qualificationes - Disce artes vivere in evolutione in campo 2026 in Udemy! Initium anni, cum multum otium habes, magna occasio est tuas artes recensere ac gradum proximum parare.
Adveniente AI, celeritas mutationis et renovationis cyclorum plus quam umquam ante acceleraverunt in ambitu evolutionis, et ut praesentiam sentiret pergere, magni momenti est animum habere ""discendi numquam desinere"".

In hac speciali notatione, tam normas technicas quae necessariae sunt in campo, tum novas artes, quas nunc scire debes, introducemus. Maioribus linguis utimur sicut Go, TypeScript, et Rust, tum suggesta evolutionis modernae sicut technologiae technologiae et Terraformes continens, tum Observabilitas, quae attentionem...",https://hatenanews.com/articles/2026/01/02/103000,https://cdn.image.st-hatena.com/image/scale/d241c445a4bb5464008da2ac9ddd82bf8f716156/backend=imagemagick;version=1;width=1300/https%3A%2F%2Fcdn-ak.f.st-hatena.com%2Fimages%2Ffotolife%2Fb%2Fblog-media%2F20251222%2F20251222135112.jpg,,"AI
GoTypeScriptRustTerraformObservabilityUdemy
Udemy11011,300
Udemy2
Udemy
20251222
GoTypeScriptRust
GoTypeScriptGoTypeScriptWeb
RustAIWeb
FintechGo
FintechGo
GoFintechAPIFintechGo
Go
Go… [+1505 chars]",,2026-01-04 03:00:59+00:00,wmo,Latvia,WCE,Europe
