index,published,topic,term,domain,language,valid,de,title,description,en,la,url,image,archive,content,quote,added,feed,country,ipcc,continent
bff4264061359eb3bf1bde0ff37b3ab0,2026-01-01T07:00:04Z,Drought,日照り続く日本,mobilelaby.com,ja,0.1,"Bis zu 56 % Rabatt!! Machen Sie Ihr neues Jahr zu einem Smart Home mit dem ersten Angebot von SwitchBot: Empfohlene Sets für verschiedene Zwecke. Am 3. Januar findet ab 9 Uhr morgens ein toller Sale mit bis zu 56 % Rabatt auf SwitchBot-Produkte statt.

SwitchBot stellte außerdem einen Gutscheincode über 400 Yen Rabatt zur Verfügung, „26NEW02“. Es kann in Verbindung mit Verkaufspreisen verwendet werden, sodass Sie das Produkt, an dem Sie interessiert sind, einfacher als gewöhnlich kaufen können.

Wir stellen Kombinationen vor, die je nach Wunsch nachgeahmt werden können, darunter Smart-Home-Einführungssets, Eingangsschlösser und Reinigungsautomatisierung. Wenn das neue Jahr näher rückt, sollten wir die kleinen Aufgaben zu Hause auf einmal reduzieren.



Smart-Home-Einführungsset

Von nun an wird es ein Smart Home...",最大56%オフ!! SwitchBot初売りセールで新年スマートホーム化：目的別おすすめセット,"SwitchBotの製品が最大56%オフになる、お得なセールが1月3日9時から開催されます。

SwitchBotから400円オフのクーポンコード「26NEW02」も提供されました。セール価格と併用できるので、気になっていた製品をいつもより手軽に導入するチャンスです。

スマートホーム入門セットをはじめ、玄関の鍵や掃除の自動化など、やりたいこと別にそのまま真似できる組み合わせを紹介します。新年のタイミングで、家の小さな手間をまとめて減らしていきましょう。



スマートホーム入門セット

これからスマートホーム化…","Up to 56% off!! Make your new year smart home with SwitchBot's first sale: Recommended sets for different purposes. A great sale with up to 56% off on SwitchBot products will be held from 9am on January 3rd.

SwitchBot also provided a coupon code of 400 yen off, ``26NEW02''. It can be used in conjunction with sale prices, so it's a chance to purchase the product you've been interested in more easily than usual.

We will introduce combinations that can be imitated depending on what you want to do, including smart home introductory sets, entrance locks, and cleaning automation. As the new year approaches, let's reduce the small tasks at home all at once.



Smart home introductory set

From now on, it will become a smart home...","Usque ad 56% off!! Fac domum tuam novum annum callidum cum prima venditione SwitchBot: Commendatur ponit ad diversos usus. Magna venditio cum usque ad 56% off in SwitchBot producta tenebitur ex 9am die 3 Ianuarii.

SwitchBot etiam codici de 400 nummis aureis praebebat, `26NEW02'. Coniunctim cum pretiis venditionis adhiberi potest, ut facultas emendi factum te solito facilius quam solitum fuistis.

Compositiones inducemus quae imitari possunt secundum quod vis facere, inter quas dolor domus introductorias ponit, seras introitus, et automationem purgatio. Cum novus annus accedit, parva negotia domi statim reducamus.



Dolor home introductory set

Posthac, efficitur dolor penatibus...",https://mobilelaby.com/blog-entry-amazon-new-year-sale-switchbot-2026.html,https://i0.wp.com/mobilelaby.com/wp/wp-content/uploads/amazon-new-year-sale-switchbot-2026.jpg?fit=1280%2C848&ssl=1,,"1
2
<ul><li></li><li></li><li>UltraPro</li><li>()BluetoothUltraPro</li><li>ICennkaPASMO</li></ul>
SwitchBotSwitchBot S10125.2
S10
SwitchBot",,2026-01-02 20:54:06+00:00,edo,Japan,EAS,Asia
